{
  "$schema": "https://json-schema.org/draft/2020-12/schema",
  "title": "bom-policy",
  "type": "object",
  "additionalProperties": false,
  "required": [
    "$schema",
    "schema_version",
    "id",
    "record_type",
    "data"
  ],
  "properties": {
    "$schema": {
      "type": "string"
    },
    "schema_version": {
      "const": "1.0.0"
    },
    "id": {
      "type": "string",
      "minLength": 1
    },
    "record_type": {
      "const": "bom-policy"
    },
    "data": {
      "type": [
        "array",
        "object"
      ]
    }
  }
}
